{"applicability":[],"attempts":[],"candidates":[],"compatibility_classes":{},"completeness":{"complete":false,"issues":[{"candidate_id":null,"code":"no_measurements","message":"No measured scope was recorded.","slot_id":null}]},"observations":[],"profiles":[],"provenance":{},"schema_version":1,"slots":[]}
